review,sentiment,,,
"I am not happy with the service of TATA SBI credit card service , I have closed them as because they use to charge me unnecessarily also not with good interest rate. Even their customer service was also not friendly and responsible ,I feel they need to improve more in their service.",0,,,
I have my credit card with SBI which was taken 2 years back and its an international card. i hold their AIR INDIA card. The credit limit was 3 lakhs and I am not satisfied with their customer service and responses so I have closed the account and not using it. My overall experience was not satisfactory,0,,,
"Service was not much I expected from SBI ,representatives and customer service was not helpful. I never get any offers from them till now , I feel they are not responsible and not coordinating much with customers so their service is average .",0,,,
"when I take credit card , they told many offers. But they has not given any offer on my credit card. I am holding this SBI credit card for past 2 years, Annual fees was 400rs, also they has provide interest on daily basis. They has taken lots of hidden charges and late fees payment, I have registered c",0,,,
"When I had been offered this card\, i was told it was a free for life card. After receiving the card, I had also called up the helpline and confirmed the same. But now I have been receiving reminders for payment of annual fees and have also been charged late payment charges. I called up the call centre",0,,,
SBI Bank credit card is not good. For no reason they used to charge rs 3000 yearly and on top of that they provide service tax as well and there is no benefits as such. The moment I got this card I used to charged some charges and for the first year I was given some benefits . Without getting any benef,0,,,
I am really not happy with the STATE BANK OF INDIA credit card . i did not even use it once and without any transaction they charged me 700 rupees and billed me . Customer service is not that good as i thought . the bank gave me a credit Limit of 20K and a cash withdraw option is also there and also a b,0,,,
"My credit card was taken with SBI 1.5 YEARS BACK . They have offered simply save International card and the credit limit was 46,000. The customer service and responses was up to the mark. The interest rate and charges are very high in the market in case of late payment. My overall experience was not sa",0,,,
State Bank of India has offered me a credit card. I am using this service for almost 8 months. I am not satisfied with the credit limit. The interest rate was high. The customer service and response was not satisfactory. I would suggest them to improve the service.,0,,,
I hold a SBI platinum credit card with a limit of 4 lakhs 50 thousand. I get 10% instant offer with bankbazaar. There is no annual charge. i have not done any EMI conversion. The customer service is not up to the mark. I am not satisfied with the customer support.,0,,,
SBI credit card service is also not satisfactory. I am using totally 6 credit cards. The credit limit was one lakhs but the services are not good. They are not giving good suggestions to the customers. The interest rate is high where other banks can do lesser.,0,,,
"From past 2 years i am using the credit card of State Bank Of India it has been a good experience . The bank gave me a credit limit of 21K and a cash withdraw limit of 4.3K , i get rewards points on using the card and there are no extra charges over the card . I am not happy with the customer service p",0,,,
"SBI bank provided me with very low credit limit for my Gold and more card, while asking them to increase the limit they had asked me take another card instead of the one am using now. I have been using this card for the past 3 years and am trying to close the card due to their lack of support from the",0,,,
"My credit card was taken with SBI 6 months back.They have offered visa card and the benefits are reward points here , I can use the points on amazon shopping. The customer service and responses was very bad . The credit limit was 20,000 which was not satisfactory.",0,,,
I have my credit card with SBI which was taken 6 months back. They have offered platinum card and I got reward points and cash back offers for this. My credit limit is 3 lakhs and I have 24/7 helpline number also. Their customer service and responses was not satisfactory and they have to improve.,0,,,
"I can say the service of SBI is not much than I expected ,representatives and customer service was helpful I don't find any fees and charges or an interest rate from their service till now . So as a overall it was a average service from SBI for my credit card service.",0,,,
"I never had any queries with the service of SBI bank ,customer support is very helpful and responsible. But offers also fine and regular,representatives where also helpful and responsible so overall it was a very good service from SBI bank credit card service.",1,,,
"Really happy with SBI as it has got very good online facility, I had placed a request for the credit card it was really fast they took around a days time and all the formalities were done by the agent who came to my place and it was done in the next 2 to 3 days once after the documents were collected.",1,,,
"The relationship with SBI visa credit card is good. They dont have good features in terms of balance transfer or It may in offers also,they have so much of drawback so that's why I dint ask to them to enhance my limit it has not been good experience.",0,,,
"Disappointed with SBI Credit card services, I am using this credit card for past 5 years. Rate of interest and Processing fees are high for EMI conversion. reward point is not good, they are not giving exact value for the reward points.Billing process is good, there are no hidden charges.",0,,,
"I got a bad impression with this IRCTC credit card, I got a call from SBI persons and i referred my friend to the credit card. They said every purchase in IRCTC has a cashback of certain amount, But actually the truth is it is with only for sleeper class. So they gave a fake promise",0,,,
I do have a credit card with State Bank of India. They are good interms of service but the credit limit was not satisfactory. The representative has promised me within 6 months limit will be upgraded into my account but not its more than 6 months still the limit remains the same. I hold a Simply Click c,0,,,
The only thing i am not happy about is that the tds is too much . The customer service was good from the bank side . The credit limit is about a lakh and i am happy with the limit . Bank gave me a cash withdraw option and a balance transfer option on the credit card . The provides bank offers on the car,0,,,
My credit card was taken with SBI almost a year now. They charging more interest rates. I can convert the money into money. I do get discount sometimes on E commerce sites. The credit limit was satisfactory. I never interacted with the customer support.,1,,,
SBI Credit card is the best they are providing very good response. The offers are not that frequent on this card. I am getting a fuel surcharge waiver of 100% . Mine is a gold and more card. They provide options for BT and BT on EMI for 2 months and the processing fee charged by them was rs 199 . They a,0,,,
"I am not satisfied with SBI credit card. Name of the card is GOLD PLATINUM credit card and I am holding this credit card for the past 8months. Specialty of the card is that there is no charges for balance transfer, but the prcoss was very slow. Overall i am satisfied with their service.",0,,,
"I have been holding a SBI Credit card. My only feedback for them is, I am unable to get in touch with the servicing team of SBI Credit card to covert the transactions in to EMI. I have recently used the card for flip kart transactions. I am not sure whether the transaction has been converted in to EMI",0,,,
The credit card which I am using from SBI is Gold card. I use this card mainly for my online trading and shopping. The customer service provided by them is pathetic as it is really tough to get connected with the customer service executives. The processing fee is high when compared to other banks and th,0,,,
The credit card which I am using from SBI is Gold card. I use this card mainly for my online trading and shopping. The customer service provided by them is pathetic as it is really tough to get connected with the customer service executives. The processing fee is high when compared to other banks and th,0,,,
"I am unhappy with the service rendered by SBI. First of all, the credit limit offered by them is very less. Hence I decided to close the card, they said that they will increase the limit no need to close the card. So, they gave me a new card, however did not increase the limit and I called the contact",0,,,
I don't use SBI platinum credit card much and there are some reward schemes. SBI credit card acceptance is too high and we can use that in all the places so I choose SBI credit card whenever I go out. SBI is improving their customer service and I too recommend them to improve better. I am getting discou,1,,,
"I had applied Credit card from the Public sector bank STATE BANK OF INDIA. My recent applications are all rejected, but i didn't know the reason. I applied third time for credit card for SBI by online partner. The best feature is we will get huge rewards benefits when we use the card in online and tie",0,,,
"I have my credit card with SBI. The credit limit was 25,000 which is satisfactory and they have offered simply save card . The annul fee was just 499 and the benefits are reward points here . I am satisfied with the customer service and responses .My overall experience was amazing.",1,,,
"I have my credit card with SBI. The credit limit was 10,000 which is not satisfactory .Their customer service and responses was up to the mark.I hold simply save card and there is no much benefits .My overall experience was good so its recommendable.",0,,,
I have my credit card with SBI . The given credit limit was satisfactory and they have offered simply click International card. The customer service and responsiveness was up to the mark. I am getting reward points as benefits . My overall experience was average so I would like to recommend to others.,1,,,
"I have my credit card with SBI which was taken 10 months back. The credit limit was 70,000 which is satisfactory . They have offered simply save international card and the benefits are reward points . Here the late payment charges are very high . Their customer service and responses was good.",0,,,
"I have my credit card with SBI which was taken 2 years back. They have offered platinum International card and the credit limit was 75,000 which is not good . The customer service and responses was satisfactory. Here the charges are very high .",0,,,
SBI provides good services on credit card when compared to all other credit cards. I am using this credit card from last 5-6 months and i paid an annual fee of Rs 499 for this credit card. I get offers like reward points in this credit card and i use net banking for making payments. I have a credit limi,1,,,
"I have my credit card with SBI.They have offered simply save International card and the given credit limit was 11,000 which is not satisfactory . I am satisfied with the customer service and response here so my overall experience was really good .",1,,,
"I have a SBI prime card from last 3 years, the credit card services are average when compared to all other credit cards. I pay an annual fee of Rs 2999 for this credit card. I get offers like reward points in this credit card. I use net banking for making payments and the credit limit is good in this c",1,,,
"Iam not that much satisfied using the State Bank Of India services since Iam using this Simply Save Credit Card Good banking service With SBI more over,the customer Service is not up to the level need to improve on response part.1 year usage of this card the credit limit is not sufficient moreover the",0,,,
"I have my credit card with SBI 1 year back. I hold simply save International card and the credit limit was 50,000. The custom,er service and responses was up to the mark. The fees and charges are average in the market. I am getting cashback offers and reward points as benefits.",1,,,
"I had a applied and got the SBI Credit card through a on line partner. I can say it is one the best credit card from a public sector bank. I faced some of the issues like One Time Password delays, when i tried to make on line transactions in real time.",1,,,
I hold a credit card with SBI and my current limit is 1 lakhs. Online service is not that not much friendly. Making the payment is bit difficult. I always used to log on to third party website for payment. The annual charge is 499.The customer service and response with the card is Fine.,0,,,
I have my credit card with SBI for about 2 years . I hold simply click International card and the credit limit was satisfactory . I am getting reward points as benefits here . The fees and charges are very high here . I have 24/7 helpline number and I have OTP device to login.,0,,,
"I have my credit card with SBI for about 5 months. They have offered simply save International card and the credit limit was 35,000 which was not stausfactroy . The customer service and responses was really good. The charges and Interest rate was average In the market.My overall experrenc was good and",0,,,
"I have my credit card with SBI for about 1 year. They have offered simply save nterantioanl card and the credit limit was 90,000 which was satisfactory . The customer service and responsiveness was up to the mark. The Interest rate and charges are avergae in the market.My overall experience was good.",1,,,
I have my credit card with SBI. The credit limit was satisfactory . The customer service and responses was up to the mark. They have offered simply save card and there is no idea about the benefits .My overall experience was good so its recommendable.,1,,,
"I have my credit card with SBI which was taken 10 years back.They have offered gold card and the credit limit was 50,000. The customer service and responses was up to the mark. Here the charges are nominal and the reward points as benefits .My overall experience was very good.",1,,,
"I have a credit card with SBI from last 2 years, the credit card services are good when compared to all other credit cards. Annual fees of Rs 499 will be waived off based on the number of transactions done. I get offers like reward points on fuel and shopping. I use net banking for making payments. I h",1,,,
"My credit card was taken with SBI. I hold simply ave International card and the credit limit was 86,000 which is satisfactory . The customer service and responses was up to the mark. Here the annual fee was charges which should not have been charged.I am getting reward points for it. My overall experie",1,,,
"I have my credit card with SBI 6 months back. They have offered simply save International card and the credit limit was 35,000 which is not satisfactory . The customer service and response was good My overall experience was good.",0,,,
"I have my credit card with SBI but not using it regularly. The credit limit was 44,000 which was satisfactory and I have platinum domestic card . Here the interest rate and charges are avergae in the market when comparing with HDFC Bank. My overall experience was average.",0,,,
I am holding a SBI TATA credit card i am using from Past 6 months .The Customer service is good form the STATE BANK OF INDIA side. There are no annual charges added also the bank gave me a credit limit of 75K and cash withdraw option is also . Plus the bank gave me a Balance transfer option on the card,1,,,
My credit card was taken with SBI 1 year. I hold simply save credit card and the credit limit was 4 lakhs . The customer service and responses was not bad and they have to improve a lot .The interest rate and charges are average in the market . My overall experience was satisfactory .,0,,,
"My credit card was taken with SBI 1 year back, they have offered simply click credit card and the credit limit was 55,000. Th customer service and responses was not up to the mark. The validity is the card is till 2020 and I have 24/7 helpine number . I have no idea about the interest rate and charges",0,,,
"SBI credit card is best to use. The cash back offers and reward points are good. It is a simply click credit card, using it for 1.5 years. The credit limit was almost satisfactory. The customer service and response is good. It is a life time free credit card.",1,,,
"I am using SBI credit card from last 5 months, the services provided by SBI credit card is good comparatively. When it comes to offers and discounts the offers are very limited i get cash back and reward points. There is no annual fee charged and i use this card for shopping purpose. I am also satisfie",0,,,
"I have a SBI air India credit card and the limit is 1k ,I am not much happy with their service there is no proper communication from them their staffs customer service is not good and they have multiple charges many times they have charged wrong bill for me so I would say the service of SBI is average.",0,,,
"Only problem with my product is with the swipping of the card\ it is not working properly. As of now I have got Rs.71000 as the limit, and I felt which is quite the exact amount that I want. Rate of Interest is not that high and am getting 45 days to pay my dues without the Interest.",0,,,
I am holding SBI credit card for long time. The rate of interest provided by SBI is pretty high when we compared with other banks. But the schemes and other services are good. The overall service of SBI is better and it would be nice if they reduce their interest rate.,0,,,
"This one is good for people who everything from Tata outlets. Because their reward points can be redeemed only in Tata outlets like Croma, Westside, Titan etc. Each point is worth Re. 1 at these outlets but that's pretty much it. Your choices are pretty much limited to it.",0,,,
"I do have the credit card with the State Bank of India which not works good for me. The charges are too much with them like they have charged me around 500 Rupees as annual maintenance fee. Customer service is not good with them and I cant able to find that what they are offering, I would like to sugge",0,,,
"I have my credit card was taken with SBI . The credit limit was 98,000 which is satisfactory . The customer sered and responses was up to the mark. I couldn't connect them that easily but once you connect, the responses is amain. I am getting simply click card and I am getting reward points as benefits",1,,,
"I Hold a Prime credit card with State Bank Of India and I have been using the credit for more than 1year and the banking service is average with them,Customer service is good moreover the credit limit is Happy and satisfied ,And the customer service is also good with SBI.",1,,,
"My credit card was taken with SBI which was taken 6 months back. They have offered simply click card and the credit limit was 50,000 which is satisfactory . The customer service and responses was up to the mark.I am getting amazing gift voucher here and 500rs voucher also. Their customer service and re",1,,,
"I have my credit card with SBI which was taken 1 year back. They have offered simply save card and the credit limit was 25,000. The customer service and responses was very good., I am satisfied with the net banking and the charges are also nominal. My experience was very good so I would like to recomme",1,,,
"I have my credit card with SBI which was taken 1 year back. The credit limit was 10\,000 which is not satisfactory and they have offered visa card . The customer service and responses was up to the mark. The validity of the card is up to 2022 and I have 24/7 helpline number .My experience was satisfacto",0,,,
I have my credit card with SBI. The credit limit was 1.9 lakhs which is not satisfactory .The customer service and responses was good. I hold IRCTC International card and there is no annual fee for this. My overall experience was very good so its recommendable.,0,,,
I have my credit card with SBI 6 years back.They have offered PRIME Card and the credit limit was 1 lakh which is satisfactory . The customer service and responses was up to the mark. Here there is no much benefits but the charges are nominal.My overall experience was good.,1,,,
"I have my credit card with SBI . They have offered prime card and the given credit limit was 1,70,000 which is satisfactory. The customer service and responses was up to the mark. The validity of the card i up to 2023. I am getting good reward points and vouchers.",1,,,
"I have my credit card with SBI . Here the give credit limit was 23\,000 which is very less so I am not satisfied at all. The customer service and responses was up to the mark. They have offered simply save International card here., They have not disclosed the limit when I have enquired before processing",0,,,
"I have my credit card with SBI 8-10 months back. They have offered domestic card and the the credit limit was 35,000 which was not satisfactory . I have 24/7 helpline number. The charges and Interest rate was avergae In the market. The customer service and responses was not bad. My overall experrenc wa",0,,,
"I have my credit card with SBI 5-6 years back. They have offered prime domestic card and the credit limit was 68,000 which was satisfactory . The customer service and responses was up to the mark. Here the charges and Interest rates are better so I would like to recommend to others.My overall experienc",1,,,
My credit card was taken with SBI 3 years back.They have offered simply save International card and the credit limit was 2 lakhs which was satisfactory . The customer service and responsiveness was good. I am getting balance transfer EMI option and convert EMI post transfer option which is amazing. Here,1,,,
State bank of India credit card department offer me a credit limit of 30k which was good compared to other credit service providers in the market also I use to receive online offers and coupons from State bank of India credit card department it was a good experience with State bank of India credit card,1,,,
It has been 3 years now that i am using the credit card of STATE BANK OF INDIA . the Customer service is good credit card related . the credit Limit is good that they provided and i am happy with credit limit . The bank gave option of Balance transfer and cash withdraw option on the card . They give of,1,,,
"I have my credit card with SBI . The credit limit was 90\,000 which was satisfactory but they hardly send notification and sms on time. I am using IRCTC credit card . The charges are reasonable and the interest rate was also average in the market.",0,,,
The credit limit was very comfortable for me for my State bank of India reward card service. The customer support department was good with State bank of India when compared to others in the market and the online application is very good with State bank of India credit card service.,1,,,
My experience with SBI savings account was good so far and i did not face any issues with this bank. I am a customer of this bank from last 4 years. They provide very good banking services comparatively. Customer service was good and they responded on time. There is no limit on withdrawal and also there,1,,,
I have my credit card with SBI .The customer service and responses was up to the mark . I am satisfied with the interest rate and charges here. The credit limit was 1.5 lakhs and they have offered simply save credit card . My overall experience was excellent and the bank is very much recommendable.,1,,,
"My credit card was taken with SBI 1.5 years back. Here I am satisfied with the credit limit and I hold visa signature card. I am getting 25-30,000 annual rewards points and can adjust with the credit bill. I have no idea about the interest rate and charges here. My overall experience was excellent and",1,,,
"I have my credit card with SBI which was taken 4 years back. The credit limit was 3/1 lakhs and I have 24/7 helpline number to contact. The customer service and responsiveness was satisfactory. I hold signature International credit card. I have no idea about the rate of interest and charges.,Credit Card",1,,,
"My credit card was taken with SBI 2 months back. The credit limit was 16,000 which is not satisfactory. They have offered money back credit card and Its an International card. The charges and interest rate are very high. I have OTP device to login and I have 24/7 helpline number. The customers service",0,,,
I have taken my credit card with SBI bank 6 years back. I would like to say SBI is the best in all aspects when comparing to HDFC. The credit limit is 5 lakhs which is really satisfactory . I hold their visa International card and The benefits re reward points here. I have no idea about the charges and,1,,,
"I have my credit card with SBI which was taken 2 years back. They have offered 2 years back. The given credit limit was 26,000 which is not satisfactory . The customer service and responses was up to the mark. Here the charges are average in the market . I had a very good experience here so its recomme",0,,,
"I have my credit card with SBI which was taken 15 years back. I hold signature's card ad the credit limit was 1,50,000 which is satisfactory . The customer service and responses was up to the mark. Here the charges are quite high than other banks in the market . I am getting reward points as benefits f",1,,,
